{
  "handoff_id": "ho_0003",
  "correlation_id": "pending_queue_2026_09_28",
  "project_id": "prj-pending-queue-2026-09-28",
  "task_id": "tsk_0004",
  "parent_task_id": null,
  "sender": "CLAUDE_CODE",
  "recipient": "CLAUDE_CODE",
  "lane": "LANE_A",
  "entity": "Neterverse Trust Enterprise (NTE)",
  "capacity": "Minister / Authorized Representative",
  "risk_tier": "R1",
  "objective": "Restore a green Validate run on the 'MCP: verify runtime tool inventory' PR in NeterverseDAOBeacon/demo-repository, or show with evidence that the PR should be closed.",
  "current_state": "BLOCKED. Known only from GitHub notification emails: the Validate workflow failed three times on this PR on 2026-09-26 between 10:37 and 10:40 UTC, each time in the single job 'validate', in about 23 to 26 seconds, each with 2 annotations. The emails carry no annotation text. The repository, its workflow file, the PR diff and the annotations have not been read by anyone in this pass, because this session's GitHub credential is refused for that organization.",
  "verified_facts": [
    "Three PR runs of the Validate workflow failed on 2026-09-26 (commits 3d8311f, 74e3e38, 38e8f50), each at job 'validate', each with 2 annotations (source: GitHub notification emails)",
    "add_repo for NeterverseDAOBeacon/demo-repository returned 'you don't have access' on 2026-09-28; list_repos shows no NeterverseDAOBeacon repository reachable from this session",
    "Khu-el/NeterverseDAOBeacon-neterverse-mcp is reachable and holds a README only (1 tracked file), so it is not the source of this workflow"
  ],
  "sources": [
    "GitHub Actions notification emails dated 2026-09-26",
    "add_repo and list_repos results, 2026-09-28"
  ],
  "assumptions": [
    "INFERRED: the PR title suggests the check verifies an MCP server's advertised tool list against a manifest; that is a reading of a title, not of code",
    "INFERRED: a repository named demo-repository may be a sample; whether it is still in use is UNKNOWN"
  ],
  "decisions": [
    "Recipient is CLAUDE_CODE. The bus has no Claude-to-Claude inbox, so this packet is filed in the to-Claude inbox (codex-to-claude/) with sender CLAUDE_CODE; the sender field, not the directory name, records provenance",
    "Filed as BLOCKED rather than OPEN work, per the principal's 2026-09-28 instruction that anything unverified pauses until its requirements are met"
  ],
  "open_questions": [
    "Does the principal want this organization's repositories in scope for Claude at all, and under which GitHub account?",
    "Is demo-repository in use, or a sample to archive? How does it relate to the canonical private neterverse-mcp repository?",
    "Is runtime tool-inventory verification covered by the pending Build Freeze scope ruling (OS / router work)?"
  ],
  "risks": [
    "Fixing CI on work the Build Freeze covers would be build work under a freeze the principal has not yet ruled on",
    "A check named 'verify runtime tool inventory' may be failing correctly - a real inventory drift - in which case making it green by editing the manifest would hide the finding"
  ],
  "dependencies": [
    "GitHub App access to the NeterverseDAOBeacon organization",
    "Build Freeze scope ruling (principal's Lane A gate register, row BUILD-FREEZE)"
  ],
  "required_output": [
    "Verbatim annotations and the step that raised them",
    "Root cause, labelled KNOWN or INFERRED",
    "A fix on branch fix/ci-mcp-tool-inventory with a green run, or a written close/archive recommendation",
    "A return handoff on this bus"
  ],
  "human_gate": "Principal grants organization access and rules Build Freeze scope before work starts; merge is the principal's.",
  "last_action": "Read the failure notifications, attempted repository access (refused), confirmed the Khu-el mirror is README-only, and filed this task as BLOCKED.",
  "next_action": "When both gates clear: claim a lease over the repository, read the two annotations on the latest failed run, and reproduce the validate job locally before editing anything.",
  "files_changed": [],
  "commits": [],
  "tests_run": [],
  "test_results": [],
  "deployment_state": "BLOCKED",
  "rollback": "Nothing has been changed in the target repository. Closing this handoff as REJECTED and the task as QUEUED-then-dropped leaves no residue.",
  "lease_owner": "",
  "lease_expiration": "",
  "status": "OPEN",
  "timestamp": "2026-09-28T23:07:39.422Z"
}
